{
  "run_id": "run-002-intermediate-gym-strength-injury",
  "phase": "requirements",
  "produced_by": "requirements-analyst",
  "version": 1,
  "status": "validated",
  "created_at": "2026-02-03T09:10:00+00:00",
  "payload": {
    "goal": "strength",
    "experience_level": "intermediate",
    "equipment": ["barbell", "dumbbell", "bench", "squat-rack", "cable-machine"],
    "days_per_week": 4,
    "session_length_minutes": 60,
    "constraints": [
      {
        "type": "injury",
        "description": "Mild shoulder impingement — avoid overhead pressing specifically; no other restriction confirmed.",
        "contraindication_tags": ["shoulder_overhead"]
      }
    ],
    "notes": "User confirmed the shoulder issue is specific to overhead pressing only.",
    "confirmed": true
  }
}
