{
  "run_id": "run-20261002-170239-dtxn",
  "phase": "requirements",
  "produced_by": "requirements-analyst",
  "version": 1,
  "status": "draft",
  "created_at": "2026-10-02T17:05:00+00:00",
  "payload": {
    "goal": "fat_loss",
    "experience_level": "beginner",
    "equipment": ["dumbbell", "bodyweight"],
    "days_per_week": 3,
    "session_length_minutes": 40,
    "constraints": [
      {
        "type": "injury",
        "description": "Pain with deep knee bending; avoid deep squats/lunges and deep knee flexion under load. Keep knee range of motion shallow-to-moderate. No other injuries.",
        "contraindication_tags": ["knee_deep_flexion"]
      }
    ],
    "notes": "Home training. Adjustable dumbbells approx. 2-20 kg per hand. Schedule: Tuesday/Thursday/Saturday.",
    "confirmed": true
  }
}
